new_filename,date_new,title.y,year.y,max_qda_imported,pubdate,abstract,index
1967-12-25batch1_1_page0.txt.txt,1967-12-25,A PERSONAL NOTE: THINGS OUTRACE IDEAS,1967,NA,"Dec 25, 1967","At the end of this year I shall discontinue my contributions in NEWSWEEK. For that reason, I take this occasion to inform those who have read my pieces over the years, especially the considerable number with whom I have had a friendly correspondence, that I shall permanently retain my office and base of operations here at NEWSWEEK, 444 Madison Avenue, New York, N.Y. 10022.",batch1_1.pdf
1967-12-11batch1_2_page0.txt.txt,1967-12-11,ROMNEY THE INCREDIBLE: AN UNCERTAIN TRUMPET,1967,NA,"Dec 11, 1967","If there were not a George Romney, Nelson Rockefeller would have to invent one. I am still willing to be convinced that the New York governor would reject a nomination if it sought him after the bloody field was strewn with the remains of the present aspirants. But even if Rockefeller does not want to be nominated, he is the authentic champion of the Eastern Establishment which cannot endure the prospect of a Republican convention without a candidate for the nomination who reflects the interests and views of that corner of the nation.",batch1_2.pdf
1967-11-13batch1_4_page0.txt.txt,1967-11-13,THE GOP MAINSTREAM: OBJECTIVES IN PACIFIC,1967,NA,"Nov 13, 1967","The word ""mainstream"" was vaguely and inaccurately used by Governor Rockefeller and others to belabor Barry Goldwater in 1964. But at this moment, when rivals for the Republican Presidential nomination are expressing their views about Vietnam, it has a special relevance.",batch1_4.pdf
1967-10-30batch1_5_page0.txt.txt,1967-10-30,PORTRAIT OF THE GOP: ACCENT ON ORGANIZATION,1967,NA,"Oct 30, 1967","Thirty-seven years have passed since the electorate in the Congressional elections of 1930 handed a vote of no confidence to the Republican Party. When we realize that a new generation has come of age since then, it is obvious why those people who shape public opinion have portrayed the GOP as an object of pity, scorn, contempt and ridicule.",batch1_5.pdf
1967-09-18batch1_8_page0.txt.txt,1967-09-18,ROCKEFELLER-REAGAN?: STRANGE BEDFELLOWS,1967,NA,"Sep 18, 1967","A leading member of the Reagan-for-President hopefuls has explained his preference in terms of ""maturity."" Ronald Reagan, he said, is more mature and sophisticated than was Barry Goldwater in 1964. But he quickly added that his people would find both Nelson Rockefeller and George Romney ""totally unacceptable.""",batch1_8.pdf
1967-08-21batch1_9_page0.txt.txt,1967-08-21,"WHAT KIND OF CITY?: HIGH UP, NOT SPRAWL",1967,NA,"Aug 21, 1967","In 1911 William Jennings Bryan was on a ship bound for Jamaica. With New York 1,100 miles behind, there was a storm and the ship struck a reef. Some passengers thought of God, their souls and their sins. Others, of their queasy innards. But the Peerless Leader conducted an investigation and concluded that there-ought-tobe-a-law.",batch1_9.pdf
1967-07-24batch1_11_page0.txt.txt,1967-07-24,"TITAN UNBOUND, I: THE STRATEGY OF SEAPOWER",1967,NA,"Jul 24, 1967","The traditional concept of Russia, which still lingers in the minds of American statesmen, is a great intercontinental land mass with a population of multiracial strains, sinister and inscrutable, ever crowding upon its neighbors, but locked in by its lack of warm-water exits to the world outside.",batch1_11.pdf
1967-06-26batch1_12_page0.txt.txt,1967-06-26,ASS IN LION'S SKIN: WHAT THE KREMLIN MISSED,1967,NA,"Jun 26, 1967","The masters in the Kremlin may or may not be familiar with that handbook for dictators, ""The Prince,"" by Niccolò Machiavelli. But their statecraft fits the pattern of that timeless book. Stalin, especially, may have known it since he was probably the best-read of the lot.",batch1_12.pdf
1967-02-20batch1_21_page0.txt.txt,1967-02-20,"WILSON, BULLITT, FREUD: AN OLD GRUDGE",1967,NA,"Feb 20, 1967","At least three long and perceptive reviews have fairly well disposed of the book ""Thomas Woodrow Wilson"" by Sigmund Freud and William C. Bullitt. Two of these were written by students of Freudianism and one by a fine historian, Barbara Tuchman. Their conclusions are that it is bad history, bad biography, bad psychoanalysis and even bad Freud.",batch1_21.pdf
1966-11-14batch1_32_page0.txt.txt,1966-11-14,PAYING FOR POLITICS?: THE OLD ABUSES CONTINUE,1966,NA,"Nov 14, 1966","It is strange indeed that members of Congress. who appropriate billions for the poor, should have neglected those of their own membership who are too poor to finance their own campaigns for re-election. Present methods of financing political campaigns are deplorable, and most who have studied the subject have concluded that assistance should be provided by the government itself.",batch1_32.pdf
1966-10-31batch1_34_page0.txt.txt,1966-10-31,ROCKEFELLER: NEW YORK HAS GROWN UP,1966,NA,"Oct 31, 1966","Recently a dear old conservative friend seemed amazed when I told him that I had decided to support Governor Rockefeller for reelection. This, he said, was apostasy in a friend of Gold water and Nixon. I replied that he is applying in a very effective way a foremost principle of conservatism.",batch1_34.pdf
1966-08-15batch1_41_page0.txt.txt,1966-08-15,THE USES OF POWER: TO HELP OTHERS,1966,NA,"Aug 15, 1966","One of Shakespeare's well-known aphorisms, which raises more questions than it answers, says that while it is ""excellent to have a giant's strength,"" it is ""tyrannous to use it like a giant.""",batch1_41.pdf
1966-07-18batch1_45_page0.txt.txt,1966-07-18,MAHAN'S LONG SHADOW: STRUGGLE FOR SEA POWER,1966,NA,"Jul 18, 1966","Critics of President Johnson are now attacking the multiplicity of his reasons for pursuing and stepping up the war in Vietnam. It must be admitted that there is some confusion, perhaps contradiction, among his stated war aims. But there is a single valid reason why we must not permit the Communists to dominate the peninsula on which South Vietnam is the key to control.",batch1_45.pdf
1966-04-11batch1_59_page0.txt.txt,1966-04-11,MENDICANT CITIES: POPULATION UPHEAVAL,1966,NA,"Apr 11, 1966","I have listened to or read a good deal of discussion about the ""blight,"" or ""plight"" or ""decay"" of American cities. But I have found no agreement among the mayors, city planners, architects and other experts about the central questions: What kind of cities do we want? How are we going to provide for such cities?",batch1_59.pdf
1966-03-21batch1_62_page0.txt.txt,1966-03-21,LBJ AND AUTO SAFETY: FEDERAL INTERVENTION,1966,NA,"Mar 21, 1966","It is significant that President Johnson, in proposing to Congress the adoption of his ""Traffic Safety Act of 1966,"" does not agree with Sen. Robert F. Kennedy's caustic arraignment of the automobile industry. Nor does he go as far as Senator Ribicoff in charging that the industry has been dragging its feet in building into its cars more provisions for the safety of the occupants.",batch1_62.pdf
1966-02-28batch1_65_page0.txt.txt,1966-02-28,GUNS AND BUTTER PLUS: THE DICKEY-LINCOLN SCHEME,1966,NA,"Feb 28, 1966",Inflation is no longer a threat. It is a fact. The most practical way to lessen its impact is to cut Federal spending. But our President says we must have guns and butter too.,batch1_65.pdf
1966-01-24batch1_69_page0.txt.txt,1966-01-24,AUTOMOTIVE SAFETY-1: INEXORABLE INCREASE,1966,NA,"Jan 24, 1966","While I have never known of any lives that have been saved by statistics, I offer a few figures as an introduction to a serial consideration of automotive safety. These will serve for the record and to remind my readers that safety on the roads, streets and highways is more important than any other national problem that the President will discuss this month except the war in Asia.",batch1_69.pdf
1965-12-27batch1_73_page0.txt.txt,1965-12-27,FREEDOM OF THE SEAS: PACIFIC BLOCKADE,1965,NA,"Dec 27, 1965","The title of this piece is one of those nice expressions which idealistic Americans, notably Woodrow Wilson in World War I, used to refute the claims of those who were interfering with what we called our rights. But for generations, especially since the Battle of Trafalgar, such freedom existed because Britain dominated the sea lanes of the world, keeping them free to commerce in peace but restricting them in war.",batch1_73.pdf
1965-10-25na.txt,1965-10-25,INEFFICIENT COLLEGES: WASTE OF TALENT,1965,NA,"Oct 25, 1965","Higher education is not overlooked in the Johnson-sponsored aid-toeducation legislation, but its benefits will fall far short unless the colleges and universities do a great deal to provide more education at less cost per student.",na
1965-09-27batch2_3_page0.txt.txt,1965-09-27,PROFITS FROM SUBSIDIES: BILLION-DOLLAR POOL,1965,NA,"Sep 27, 1965","When the recipients of government handouts get rich enough to start a lending bank it is time to revise not only policies but the meaning of words. Yet an amazing proposal for such a bank has been made by the National Rural Electric Cooperative Association on the advice of a venerable Wall Street investment firm, Kuhn, Loeb and Co.",batch2_3.pdf
1965-05-24batch2_21_page0.txt.txt,1965-05-24,TWO GREAT FLORENTINES—I: 'DE MONARCHIA',1965,NA,"May 24, 1965","Florence—The 700th anniversary of the birth of Dante Alighieri will be suitably recognized this year in Rome and in his native Florence. He was born, he tells us—and never was there a more self-revealing poet-under the sign of Gemini, the month following May 21, in 1265.",batch2_21.pdf
1965-04-12batch2_27_page0.txt.txt,1965-04-12,NIXON ON VIETNAM: RISK INEVITABLE,1965,NA,"Apr 12, 1965","In an off-the-record speech before a private group in New York, Richard Nixon analyzed the American position in Vietnam with such precision and force that many who heard him persuaded him to commit it to writing.",batch2_27.pdf
1965-01-18batch2_39_page0.txt.txt,1965-01-18,"COOL OFF, REPUBLICANS!: OUTCRIES OF FRUSTRATION",1965,NA,"Jan 18, 1965","What Republicans generally, and especially those who are members of the National Committee, should seek in the next few months is a moderation of the hysteria which followed the great November defeat. This is not to be attained by merely putting Dean Burch on the bloody sacrificial altar.",batch2_39.pdf
1964-12-28batch2_42_page0.txt.txt,1964-12-28,FOLLOWING THE RETURNS: CUTTING CORNERS,1964,NA,"Dec 28, 1964","Dissent from a popular decision always involves painful soul-searching by a judge, a legislator, or a journalist. And when the decision may claim moral justification, opposition is doubly hard. That is why this piece is written with the greatest of reluctance.",batch2_42.pdf
1964-10-26batch2_51_page0.txt.txt,1964-10-26,NIXON'S ROLE IN 1964: RECORD OF LOYALTY,1964,NA,"Oct 26, 1964","If the acclaim now given by conservative people to Richard Nixon for his campaign over the nation in support of the Goldwater-Miller ticket had been accorded him by those same people in 1960, he would now be running for re-election as President, and John F. Kennedy and Lyndon B. Johnson would be senators from their respective states.",batch2_51.pdf
1964-09-28batch2_55_page0.txt.txt,1964-09-28,LBJ'S GREAT SOCIETY: COLLECTIVE MUDDLING,1964,NA,"Sep 28, 1964","It has become a tradition for a Presidential candidate to have a general characterization for his miscellaneous collection of panaceas. This is to provide a seeming coherence for irreconcilable items of policy. TR had two such characterizations, the New Nationalism and the Square Deal.",batch2_55.pdf
1964-08-24batch2_60_page0.txt.txt,1964-08-24,GOLDWATER'S STAFF-1: A PERSONAL ORGANIZATION,1964,NA,"Aug 24, 1964",Many factors play a part in winning or losing an election. Some of these are unexpected events which cannot be anticipated or planned. But the major element in political success is organization.,batch2_60.pdf
1964-07-20batch2_65_page0.txt.txt,1964-07-20,WAR ON BUSINESS: SWEEPING DECISION,1964,NA,"Jul 20, 1964","While the public is fascinated by LBJ's war on poverty, several of the agencies over which the great almoner presides are pursuing their war on business with unabated vigor. A good example is a case which originated with the Darlington Manufacturing Co., a small textile operation which had its origin in South Carolina in 1883.",batch2_65.pdf
1964-06-22batch2_69_page0.txt.txt,1964-06-22,AFTER THE PRIMARIES: WHAT MAINSTREAM?,1964,NA,"Jun 22, 1964","The hysterical outcries of many politicians and pundits during the first days after the California primary were genuinely amusing. Perhaps the distemper which afflicted these people was due to their loss of faith in their own infallibility and influence. For after they had hammered Gold-water for more than two years with verbal artillery, a sufficient number of Republicans, by their primary votes and in their selection of delegates, seem to have made the nomination of the Arizona senator inevitable.",batch2_69.pdf
1964-04-20batch2_78_page0.txt.txt,1964-04-20,The Essential South: THE EISENHOWER DECLINE,1964,NA,"Apr 20, 1964","OKLAHOMA City—The emergence of a young and growing Republican Party in the hitherto Democratic South may well be the salvation of the Republican cause over the nation. Indeed, it may be essential to the preservation of a national twoparty system. This is why I have attempted to study this remarkable political change during a five weeks' trip through the South this spring and also in 1963.",batch2_78.pdf
1964-04-13batch2_79_page0.txt.txt,1964-04-13,Goldwater's Managers: THE PRECEDENTS,1964,NA,"Apr 13, 1964","PHOENIX—During the final weeks of the wretched New Hampshire primary campaign and since, a great deal of criticism of Senator Goldwater's management and managers has been published. Politics is like baseball. If the team is leading on Sept. 1, the manager is hailed as a genius.",batch2_79.pdf
1964-03-16batch2_83_page0.txt.txt,1964-03-16,RFK's Power Play: STRATEGIC PATRONAGE,1964,NA,"Mar 16, 1964","THE robust ambition of Robert F. Kennedy to be the Democratic Vice Presidential nominee, the political assets which are claimed for him, and President Johnson's distaste for his Attorney General are political considerations of the utmost importance in these early months of 1964.",batch2_83.pdf
1964-02-24batch2_86_page0.txt.txt,1964-02-24,Frank Killory's Failure: THE BOOM,1964,NA,"Feb 24, 1964","WHEN a political writer as talented as Henry J. Taylor writes a political novel it is news. Moreover, the characters he draws in ""The Big Man""* and the life he portrays are so close to us that interest quickens. An evaluation of his novel as such is beyond my capacity and my departmental responsibility.",batch2_86.pdf
1964-01-13batch2_92_page0.txt.txt,1964-01-13,Goldwater's Decision: POPULAR DEMAND,1964,NA,"Jan 13, 1964","IF BARRY GOLDWATER had the Presidency in mind twelve years ago when he left behind the pleasant life of a successful businessman and entered the arena of politics, the evidence fails to support it. There have been many perennial seekers of the Presidency in our history, and certain rituals have developed which border on superstition.",batch2_92.pdf
1963-12-16batch2_96_page0.txt.txt,1963-12-16,After the Party Truce: CONTENDING POLICIES,1963,NA,"Dec 16, 1963","WHEN these brief December days have passed into history, the business of the American people will be to prepare for a momentous choice of national policies, of party government, and of the individual who will occupy the White House after 1964. Past patterns of public behavior after the death of a President in office have so far been followed.",batch2_96.pdf
1963-11-11batch2_101_page0.txt.txt,1963-11-11,Running for President: THE EARLY DAYS,1963,NA,"Nov 11, 1963","""ANYONE who wants to run against John F. Kennedy,"" Richard M. Nixon said in Paris, ""would have to have a hole in his head if he didn't start now to build up a staff, especially a research staff."" That fact about any candidate for a Presidential nomination, unless he is already in the White House anticipating a second term, seems to be overlooked by those people who are speculating about a draft for Nixon or the nomination of someone other than Goldwater or Rockefeller.",batch2_101.pdf
1963-10-28batch2_103_page0.txt.txt,1963-10-28,After 30 Years: PUBLISHING INTEGRITY,1963,NA,"Oct 28, 1963","IN THIS issue, under date of Oct. 28, 1963, my subject concerns a matter of personal privilege. Under the date of Oct. 28, 1933, there appeared the first issue of the magazine Today. Its publisher and principal backer was Vincent Astor. I was editor and in that capacity I contributed a signed article which thereafter appeared each week.",batch2_103.pdf
1963-09-16batch2_109_page0.txt.txt,1963-09-16,Lasky's Estimate of JFK: SCHLESINGER-INSPIRED,1963,NA,"Sep 16, 1963",FEW Presidents in their first term have been the subject of such a considerable literature as John F. Kennedy. This is explained in part by the eager cooperation provided for writers by the Kennedy brothers.,batch2_109.pdf
1963-08-12batch2_114_page0.txt.txt,1963-08-12,The Young Republicans: THE GROUPS,1963,NA,"Aug 12, 1963",IN SEVERAL articles I have pointed out that the future of the Republican Party and of truly conservative principles lies with the younger generation. In the House of Representatives three or four dozen members whose ages range from 30 to 55 have shown a marked capacity to work together.,batch2_114.pdf
1963-07-29batch2_116_page0.txt.txt,1963-07-29,Goldwater on Extremists: THE SENATOR AGREES,1963,NA,"Jul 29, 1963","GOVERNOR Rockefeller's attack upon extremists was immediately interpreted in some sections of the press as a pointed criticism of Senator Goldwater. The governor later, in response to press questioning, said that ""while I have great respect for Barry's patriotism, his dedication to political life ...",batch2_116.pdf
1963-07-15batch2_118_page0.txt.txt,1963-07-15,How the Parties Differ—I: A NEW STUDY,1963,NA,"Jul 15, 1963","""Is THERE a real difference between the two political parties?"" Countless Americans are troubled by this question, and many would answer: ""No."" This troubles parties and candidates, since it is their task to show that there is a difference and that their side is the one to support.",batch2_118.pdf
1963-05-27batch2_125_page0.txt.txt,1963-05-27,Southern Republicanism: AGING DEMOCRATS,1963,NA,"May 27, 1963","THE purpose of my visits in April in Texas, northern Louisiana, Mississippi, Alabama, and South Carolina was not to cover the twice-told story of racial strife. It was to study at first hand a quite different protest. I found that countless thousands of young men and women in the colleges and universities and their predecessors graduated since the war are fed up with the one-party, nominally Democratic regime which has dominated public life in Southern states ever since the Reconstruction.",batch2_125.pdf
1963-04-15batch2_131_page0.txt.txt,1963-04-15,Report on Wasteland—I: UNIQUE STATUS,1963,NA,"Apr 15, 1963","HEREWITH begins a report on a report which incorporates many reports. Some who find my recital boring may seek more heady stuff. But I warn you that in my tale of government wastefulness you are the patsies. The money which the bureaucrats are tossing away is your money earned by the sweat of your brow, the aches in your joints, and the worries that haunt your days and nights.",batch2_131.pdf
1963-03-25batch2_134_page0.txt.txt,1963-03-25,The Image of Richard III: SYMBOL OF EVIL,1963,NA,"Mar 25, 1963",THE long-subdued literary interests of Washington correspondents now find release in current copy. For the New Frontier has added patronage of the arts to the bulging wallet of Federal concerns.,batch2_134.pdf
1963-02-11batch2_140_page0.txt.txt,1963-02-11,Two Indispensable Men: MILLER AS SPOKESMAN,1963,NA,"Feb 11, 1963","THE Republican National Committee, like its counterpart on the Democratic side, has limited authority but great importance. That is now underlined because there is no Republican President and also because a Presidential campaign is coming for which preparations must be made.",batch2_140.pdf
1963-01-21batch2_143_page0.txt.txt,1963-01-21,The U.S. vs. The U.S—I: ESTABLISHED PRINCIPLE,1963,NA,"Jan 21, 1963","IN THIS time of transition, or of greatness, or of whatever oratorical flourish may have it, the Administration in Washington stresses motion, not reflection. We are blinded by incandescent illusions. But this government often blinds itself. In its haste to raze the ruins of the past, basic structures of principle are weakened or destroyed.",batch2_143.pdf
1962-12-31batch2_146_page0.txt.txt,1962-12-31,News: Power and Policy: IN WALPOLE'S DAY,1962,NA,"Dec 31, 1962","SOME news writers become news makers. Immense press space has been given to the ""eyeball-to-eye-ball"" article in The Saturday Evening Post by Stewart Alsop and Charles Bartlett, to whom the President referred in his news conference of Dec. 12 as ""old friends."" Less attention was given to an equally sensational article by Alsop in the preceding issue of that magazine, an article which disclosed the war strategy created by Defense Secretary McNamara, as well as an article in Look by Fletcher Knebel which could hardly have been written in so short a time without official help.",batch2_146.pdf
1962-11-12batch2_153_page0.txt.txt,1962-11-12,Law in This Crisis: HOMAGE TO VIRTUE,1962,NA,"Nov 12, 1962","IT IS well to bear in mind these days the fragile nature of what is called international law. Even the word ""international"" has been in use less than a century and a half. Moreover, the word ""law"" applied to the relations of nations is not analogous to its meaning within a nation.",batch2_153.pdf
1962-10-15batch2_157_page0.txt.txt,1962-10-15,Nixon Versus Brown: THE TABOO,1962,NA,"Oct 15, 1962",Los ANGELES—That the authority and responsibility of the states have been so largely submerged by the Federal government is a fact regretted by all believers in our constitutional system. But it is a fact which confronts every candidate for a governorship.,batch2_157.pdf
1962-09-10batch2_162_page0.txt.txt,1962-09-10,The GOP's Young Men: DOING THEIR HOMEWORK,1962,NA,"Sep 10, 1962","I WONDER if you have noticed that there are fewer and fewer references these days to the GOP ""Old Guard""? This is because it is now difficult to make people believe that the Republican Party is a worm-eaten antique when so many of its active and most influential leaders have not reached threescore.",batch2_162.pdf
1962-08-13batch2_166_page0.txt.txt,1962-08-13,You Win in the Precincts: LABOR'S 'HOW TO WIN',1962,NA,"Aug 13, 1962","IN MY years as a college teacher of what is called ""political science"" I attempted to get away from theory and history and help students learn some of the realities of everyday politics. I decided to have practical and successful politicians talk to my classes.",batch2_166.pdf
1962-07-30batch2_168_page0.txt.txt,1962-07-30,Party Unity and Strength: AUXILIARY GROUPS,1962,NA,"Jul 30, 1962",Two weeks ago I commented on the new National Republican Citizens Committee and said that Senator Goldwater's objections were based upon reconcilable points of difference. I then received a friendly letter from the senator restating his disagreement.,batch2_168.pdf
1962-03-19batch2_186_page0.txt.txt,1962-03-19,Tyranny of Minorities: NEW SPECIAL INTERESTS,1962,NA,"Mar 19, 1962","PERHAPS the most treasured and distinctive of American ideals is that of a classless society. The vision of every American is that he is a citizen of a nation in which, by the grace of God, he may by his efforts move his status from low to high place. He knows too that if his efforts fail or he manages badly or if he chooses ease or dissipation rather than effort, he will move downward.",batch2_186.pdf
1962-02-12batch2_191_page0.txt.txt,1962-02-12,Big-City Politics: WHAT HAPPENED,1962,NA,"Feb 12, 1962",ISOLATED political battles hinge upon an assortment of factors. But the outcome of a protracted conflict between parties depends upon what they do to resolve a relatively few factors. One of these is organization. Since 1960 a preoccupation of many Republicans with odds and ends of ideology has led some to a belief that future success will depend upon winning over Democratic voters by a sincere leap to the left.,batch2_191.pdf
1962-01-22batch2_194_page0.txt.txt,1962-01-22,Splinter-Party Folly: TWO-PARTY PRINCIPLE,1962,NA,"Jan 22, 1962","A NUMBER of conservative Republicans in New York have received a manifesto and appeal for support by a few ardently conservative men and women. This document calls for the creation of a Conservative Party in New York State. The stated purpose is to ""bring down [I assume this means to defeat] the liberal Republican apparat"" which would ""transform the Republican Party into a carbon copy of the worst elements of its Democratic antagonist.""",batch2_194.pdf
1961-12-25batch2_198_page0.txt.txt,1961-12-25,Destiny of a Continent: 'WELL-TRODDEN PATH',1961,NA,"Dec 25, 1961",AN AMERICAN needs to shed none of his patriotism if he views with a great deal of sympathy the British Government's doubts about our support of the United Nations' military action in Katanga. For the explanations of our officials are ambiguous and coated with semantic frosting.,batch2_198.pdf
1961-11-06batch2_205_page0.txt.txt,1961-11-06,Comedy ON a Dark Stage: MACHINE PRODUCT,1961,NA,"Nov 6, 1961",ON NOV. 7 the voters of New York City are going to pass upon one of the most preposterous claims ever made before an American electorate. They must accept or reject the proposition that Mayor Robert Ferdinand Wagner Jr. alone is the Hercules capable of cleansing a stable of which he has been the custodian for nearly eight years.,batch2_205.pdf
