new_filename,date_new,title.y,year.y,max_qda_imported,pubdate,abstract,index
1947-09-22batch7_202_page0.txt.txt,1947-09-22,The Eisenhower Situation,1947,NA,"Sep 22, 1947","THE time has come to stop annoying General Eisenhower with questions about his availability for the Presidency. He has said all that Americans are entitled to expect. In fact, his patience with reporters has already led him to say more than the circumstances require. The event is in the hands of the American people, of their political leaders and of the inscrutable circumstances of the next nine months.",batch7_202.pdf
1947-08-25batch7_206_page0.txt.txt,1947-08-25,Hollywood's War With England,1947,NA,"Aug 25, 1947","LOS ANGELES—What there is left of the optimism which created the movie industry now finds expression in the refrain: ""England's going to be sorry for this blow!"" It might be added that an excess of the same optimism prevented the industry from anticipating the blow. It was believed here, up to the moment that Prime Minister Attlee announced an ad valorem tax of 75 per cent on American films, that a compromise would be arranged.",batch7_206.pdf
1947-07-14batch7_211_page0.txt.txt,1947-07-14,Is Truman Really President?,1947,NA,"Jul 14, 1947","OUR united and assorted states have lived with their old Constitution a long time, and they still love it. But they have found in it glaring ambiguities and omissions. For instance, it would seem that the very important matter of who should succeed to the Presidency, if the person holding that office should meet one of the many fates to which our flesh is heir, could be put into understandable language.",batch7_211.pdf
1947-06-09batch7_216_page0.txt.txt,1947-06-09,Can Truman Win in 1948?,1947,NA,"Jun 9, 1947",THE current optimism of Democrats as they look toward 1948 seems to be based on polls showing a rise in Truman's popularity. That rise is no doubt due to his firm stand against John L. Lewis: to the excellence of some of his appointments; to his steady following o a fairly conservative line in domestic affairs; and to his generally dignified and modest air as he goes about his business.,batch7_216.pdf
1947-05-19batch7_219_page0.txt.txt,1947-05-19,Politics and the Labor Bills,1947,NA,"May 19, 1947","The demands of politics are present in the current labor pains of Congress. The election year 1948 is a reality, and politicians are realists. But the long record of the Senate debate shows less demagoguery than is usual in such important legislation. As might be expected, the quality of the Senate debate is much higher than that which characterized the passage of the House labor bill.",batch7_219.pdf
1947-04-14batch7_224_page0.txt.txt,1947-04-14,Outlaw American Communism,1947,NA,"Apr 14, 1947","SAN FRANCISCO—Since the days of Denis Kearney, the State of California has seen the rise and fall of many radical movements. Under their stimulus and despite their agitation, the state has moved ahead in economic power and political enlightenment. But California's 8,553 enrolled Communists comprise a group which is no gentle irritant.",batch7_224.pdf
1947-03-31batch7_226_page0.txt.txt,1947-03-31,Legitimate Propaganda,1947,NA,"Mar 31, 1947","The destiny of the State Department's Office of International Information and Cultural Affairs (OIC) rests with an economy-minded Congress. The OIC wants something like $25,000,000. At the present writing, there is a disposition among Republican House leaders to mow it down along with many other publicity agencies.",batch7_226.pdf
1947-02-03batch7_234_page0.txt.txt,1947-02-03,A Fortress Can Become a Prison,1947,NA,"Feb 3, 1947","Government is a tricky and perilous partner. Time and again, some group or interest has offered its votes as collateral and has moved into the big house on the plaza, only to find, after a while, that there are bars on the windows and a new landlord. Samuel Gompers warned labor of this danger.",batch7_234.pdf
1947-01-20batch7_236_page0.txt.txt,1947-01-20,Retirement With Honor,1947,NA,"Jan 20, 1947","It is a notable event when a man can retire voluntarily, gracefully and without speculation about reasons other than those publicly given. But James F. Byrnes is a notable man and statesman. He has attained almost every governmental distinction except the Presidency, and he narrowly missed that.",batch7_236.pdf
1946-12-09batch7_242_page0.txt.txt,1946-12-09,Who Makes Policy?,1946,NA,"Dec 9, 1946","The assurance with which John L. Lewis has defied the Executive power of the government arises from a fact which Lewis knows and which the rest of us only dimly realize. That fact is that high policy is now being made neither by Congress, which should make it, nor by the Executive, which has made it for several years.",batch7_242.pdf
1946-11-11batch7_246_page0.txt.txt,1946-11-11,The Presidency,1946,NA,"Nov 11, 1946","Not the least of the features of the late campaign was what happened to the massive institution of the Presidency. Organization Democrats far and near acted as if they were ashamed of their own President. His name was barely mentioned in speeches and campaign literature. With an eye to the Gallup polls, which indicated a drop in Mr. Truman's popularity from a honeymoon percentage of 87 per cent to an October brown of 32 per cent, they decided that he was to be written off as a loss.",batch7_246.pdf
1946-10-14batch7_250_page0.txt.txt,1946-10-14,If the Republicans Win the House,1946,NA,"Oct 14, 1946","This column is not concerned with prophecy. But it requires no seer's vision to note that in the past three weeks there have been authentic signs of a powerful, not t-0 say overwhelming, tide against the party in power. If this trend carries on until election, we shall have not only a Republican House by a comfortable margin, but quite conceivably a Republican Senate as well.",batch7_250.pdf
1946-09-16batch7_254_page0.txt.txt,1946-09-16,Truman's Home State,1946,NA,"Sep 16, 1946",St. Louis—Political people here tell you that President Truman's personal prestige is at stake in Missouri. So is Hannegan's. And so the President and the Postmaster General are preparing to shoot the works out here this fall to elect a senator and a good majority of congressmen.,batch7_254.pdf
1946-08-19batch7_258_page0.txt.txt,1946-08-19,"Politics in Idaho, Washington and Oregon",1946,NA,"Aug 19, 1946","Portland—Firsthand observations of the political conditions and trends in Idaho, Washington and Oregon emphasize factors which I noted last week. The enormous crop now just at the beginning of the harvest, together with almost full employment, induces a feeling of well-being that dulls people's interest in politics.",batch7_258.pdf
1946-07-08batch7_264_page0.txt.txt,1946-07-08,How You Can Get a Better Congress,1946,NA,"Jul 8, 1946","Bob La Follette has lived in the atmosphere of the United States Senate during 41 of his 51 years of life. For six of those years, he was secretary to his father, and for 21 years he has been a senator in his own right. No senator can claim such an education in the science of government.",batch7_264.pdf
1946-06-24batch7_266_page0.txt.txt,1946-06-24,Prohibition by Indirection?,1946,NA,"Jun 24, 1946","If Prohibition comes to this country, it ought to enter by the front door, lay its case on the table and be judged on its merits as a measure of prudence and morals. It once came through a back door marked ""War Necessity."" Now it is trying to enter at another irregular entrance marked ""Save Food.""",batch7_266.pdf
1946-05-13batch7_272_page0.txt.txt,1946-05-13,America Likes the UN,1946,NA,"May 13, 1946",The UN is making a hit with the American people. This is my conclusion after a good deal of observation and inquiry about the effect of the Bronx meetings on public opinion in the Middle and Far West. The light of a sunrise is sometimes best seen by looking west.,batch7_272.pdf
1946-04-29batch7_274_page0.txt.txt,1946-04-29,The Faith of Harold Stassen,1946,NA,"Apr 29, 1946","ST. PAUL, MINN.—Three years ago this spring, there appeared in this column an account of a conversation with Harold E. Stassen. He was then 36 and in his third term as Governor of Minnesota, clearing his desk and preparing to resign and go into the Navy.",batch7_274.pdf
1946-03-11batch7_281_page0.txt.txt,1946-03-11,Report to the Russians,1946,NA,"Mar 11, 1946","This piece is not written to argue or to interpret any of the territorial or military issues between Soviet Russia and her late allies. Nor is it directed primarily to American readers. Its purpose is, rather, to put into words a picture of American opinion, directed, as it were, to the eyes of responsible official Soviet Russia.",batch7_281.pdf
1946-02-04batch7_286_page0.txt.txt,1946-02-04,The State Is a Faithless Trustee,1946,NA,"Feb 4, 1946","The President's course these days sweeps government deeper and deeper into the realm of private rights and personal freedom. Quasi-compulsory arbitration, government seizure of plants, a long series of recommendations in the annual message, covering subsidies, housing, Federal power projects and socialized medicine, mark the conduct of an Administration which is scarcely reckoning how difficult it will be to retrace its steps from the jungle of state power.",batch7_286.pdf
1946-01-21batch7_288_page0.txt.txt,1946-01-21,A Carnival of Ghosts,1946,NA,"Jan 21, 1946","Sen. Wayne Morse's reference to Sen. Robert A. Taft as a ""reactionary"" suggested nothing so much as the pot's well-worn reference to the color of the kettle. Are we to have a revival of the battle, long ago, between Taft conservatism and La Follette progressivism?",batch7_288.pdf
1945-12-03batch7_295_page0.txt.txt,1945-12-03,Time and Space for Reason to Grow,1945,NA,"Dec 3, 1945","The seeds of the late conflict in Europe were in civil war in Spain, and now the harvest is in civil conflicts everywhere.",batch7_295.pdf
1945-11-26batch7_296_page0.txt.txt,1945-11-26,War-Born Idealism,1945,NA,"Nov 26, 1945","Two months ago, the point was made in this column that, since this country has emerged as a world power, many trained Americans will be needed in international service. The column in which this subject was discussed was included in NEWSWEEK'S Battle Baby edition and went to the men and women in the armed services.",batch7_296.pdf
1945-10-08batch7_303_page0.txt.txt,1945-10-08,How to Behave Like a World Power: 8—Political Policies,1945,NA,"Oct 8, 1945",A world power whose international political policies are marked by drift and improvisation would not be a world power long. Russia and Britain have had fixed policies. Neither revolution nor war nor economic change has fundamentally altered them. The evidence of that is to be seen in their London demands.,batch7_303.pdf
1945-08-06batch7_311_page0.txt.txt,1945-08-06,The British Election and the U. S.,1945,NA,"Aug 6, 1945","At any moment in the past ten years this remarkable British political upset would have had very important influences over here. A British Labor victory during New Deal days, from 1933 to 1939, would certainly have moved us further to the left on the domestic front.",batch7_311.pdf
1945-07-30batch7_312_page0.txt.txt,1945-07-30,The Revival of German Political Parties,1945,NA,"Jul 30, 1945","Four weeks ago the German Communist party was permitted to revive in the Russian zone of occupation. Two weeks later, four more parties were revived there. And now, under certain reasonable restrictions, the basis of party life has been re-created.",batch7_312.pdf
1945-06-25batch7_317_page0.txt.txt,1945-06-25,A Square Deal for Congressmen,1945,NA,"Jun 25, 1945","Unless President Truman or some other force outside Congress presses for action, the problem of improving Congress, both in membership and in working efficiency, will end in a chaos of irrelevancies. It is not a question of salaries alone, but of Congressional organization, equipment and procedure.",batch7_317.pdf
1945-05-21batch7_322_page0.txt.txt,1945-05-21,Let's Not Hurry This Time,1945,NA,"May 21, 1945",The most significant fact yet shown by the proceedings at San Francisco is the necessity of drawing a sharp distinction between those postwar international issues which need immediate action and those which need time and patience. This distinction was certainly not foreseen and planned for by many of the delegates who went gaily to the Golden Gate with nice formulas for settling everything at once.,batch7_322.pdf
1945-04-09batch7_328_page0.txt.txt,1945-04-09,World Order Under Law,1945,NA,"Apr 9, 1945","In the Crimean statement appears a pledge of the Big Three to build ""world order under law."" This is not a mere rhetorical flourish or an empty expression of political theory. It is a basic concept whose light must guide even' step now taken from San Francisco onward.",batch7_328.pdf
1945-03-05batch7_333_page0.txt.txt,1945-03-05,The Hun Didn't Pay,1945,NA,"Mar 5, 1945","During the last war, the French cried out: ""The Hun shall pay!"" The British echoed and amended: ""The Hun shall pay cash."" The Hun did not pay. Instead, he collected from his former enemies the means to attack them again. This strange sequence is a chapter in economic history which explains why the men at Yalta inserted after the word ""reparations"" the two little but momentous words ""in kind.""",batch7_333.pdf
1945-02-19batch7_335_page0.txt.txt,1945-02-19,The Job Budget,1945,NA,"Feb 19, 1945","Whether March comes in like a lion or a lamb for the proposed new Secretary of Commerce, the country is indebted to Mr. Wallace for a revealing lesson in political economy. For that candidate for the Commerce job has presented the first detailed plan for spelling out the promise of 60,000,000 jobs.",batch7_335.pdf
1945-01-22batch7_339_page0.txt.txt,1945-01-22,Senator Vandenberg's Leadership,1945,NA,"Jan 22, 1945","An important factor behind recent British, French and Russian opinions and actions designed to stabilize Europe by a series of two-party treaties is a great and sinister fear. That fear rises from a belief that after American military power has finished the conquest of Germany, differences in the United States may cause us to withdraw our heavy and decisive hand from Europe and that, once more, a malignant Germany may strike.",batch7_339.pdf
1944-12-04batch7_346_page0.txt.txt,1944-12-04,A Code and a Man,1944,NA,"Dec 4, 1944","On one important point relating to the future organization of peace, both candidates in the late campaign were wholly agreed. Both said that the American member of the security council of the proposed peace league should not be compelled to get authorization from Congress every time the council decided to use force against a breaker of the peace.",batch7_346.pdf
1944-11-27batch7_347_page0.txt.txt,1944-11-27,The Sinews of the Parties,1944,NA,"Nov 27, 1944","After every campaign, conversation flourishes among amateur political strategists about what the defeated candidate should or should not have said. It seems thus to be assumed that campaigns are won or lost by what is said or left unsaid by the candidates. But it is very clear that nothing that Mr. Dewey said or could have said would have elected him.",batch7_347.pdf
1944-10-02batch7_353_page0.txt.txt,1944-10-02,West Coast Labor and Politics,1944,NA,"Oct 2, 1944","PORTLAND, ORE. — The preponderant political issue this year in Oregon and Washington is the relation of the Federal Government to organized labor. This is the chief subject of discussion in political speeches, editorials and person-to-person talk. What has Mr. Roosevelt done to or for labor, and why should he be or not be reelected on that account?",batch7_353.pdf
1944-09-04batch7_357_page0.txt.txt,1944-09-04,France Up and Rumania Down,1944,NA,"Sep 4, 1944","Well, Lafayette, look who's here again. When France awakens after the happy days of liberation, there will be many serious matters to concern her and her Allies. On the economic side, the situation is not likely to be as serious as expected. Half of the French are farmers whose forebears, over the centuries, have been eating their own food and drinking their own wine, despite conquest from without and bad government within.",batch7_357.pdf
1944-08-21batch7_359_page0.txt.txt,1944-08-21,Political Strategy in 1944,1944,NA,"Aug 21, 1944","Political, unlike military campaigns have never been directed with a nice sense of order. Pictures of political field marshals never show them poring over maps and figures. There are maps and figures around national headquarters, of course, but they are left to professorial people whom the big shots never regard as being quite right in the head.",batch7_359.pdf
1944-07-03batch7_365_page0.txt.txt,1944-07-03,Improved Campaign Methods,1944,NA,"Jul 3, 1944","This is going to be a good year for the two parties to reconsider their campaign methods. Politicians are superstitious. Even as great an innovator as Mr. Roosevelt observes such a custom as wearing the same hat throughout a campaign. I'm not sure that he used the same hat in every Presidential campaign, but if that be true also, the hat must be a veritable antique by now, in view of the long succession of rings into which it has been tossed.",batch7_365.pdf
1944-06-19batch7_367_page0.txt.txt,1944-06-19,An Invasion at Home,1944,NA,"Jun 19, 1944","Feebly competing for attention with the tremendous news of the invasion was the account of a Supreme Court decision which, in peacetime, would claim first place. This decision, handed down June 5, involved an invasion of the right of the states to regulate insurance.",batch7_367.pdf
1944-05-08batch7_373_page0.txt.txt,1944-05-08,Charley's McCarthys,1944,NA,"May 8, 1944","Charley Michelson, as director of publicity for the Democratic National Committee, has proved that a man can live a long and interesting life by serving as a professional agent in other men's controversies. What is more, he has proved that he can do this without very much personal attachment to the policies, causes and ambitions of those whom he has served.",batch7_373.pdf
1944-04-03batch7_378_page0.txt.txt,1944-04-03,The Essential Ingredients of Victory,1944,NA,"Apr 3, 1944","It is becoming more evident every day that Russian diplomacy is as good as the Russian Army, which is saying a lot. For diplomacy must be an instrument of war, just as war is an instrument of diplomacy. Great nations in modern times have always, in their most successful years, articulated diplomacy and military power.",batch7_378.pdf
1944-03-27batch7_379_page0.txt.txt,1944-03-27,Political Straws in March Winds,1944,NA,"Mar 27, 1944","Prophecy is not within the domain of this column. But it does make. it a major concern to get for its readers the Opinions of informed people on the Political Situation over the country. For the purposes of this week's essay, I shall try to present a summary of such opinion on the present status of the race which will culminate in the RepubliCan convention.",batch7_379.pdf
1944-02-07batch7_386_page0.txt.txt,1944-02-07,Dewey and General Sherman,1944,NA,"Feb 7, 1944","Before many weeks, the race for the Republican nomination will probably involve an assertion by the Willkie supporters that Governor Dewey cannot, in light of his previous statements, accept a nomination. This assertion will be violently debated and innumerable versions will be provided about what Mr. Dewey's statements really mean.",batch7_386.pdf
1944-01-31batch7_387_page0.txt.txt,1944-01-31,Politics and the National Income,1944,NA,"Jan 31, 1944","We are now witnessing a kind of warming-up process in fourth-term politics. The formula will be simple. There will be no elaborate plan for proposed social reform. The New Deal label, with all its liabilities, will be dropped. The Win-the-War slogan proposed by the President will be only incidental.",batch7_387.pdf
1943-12-20batch7_393_page0.txt.txt,1943-12-20,Hyphenated Votes,1943,NA,"Dec 20, 1943","On one or two occasions I have, in this column, referred to the repercussions among American voters of disputes over boundaries and the like in Eastern Europe. Such references resulted from a feeling, which I have had for a long time, that as postwar settlements are approached, there will be those who will seek political advantage from hyphenated votes in American cities.",batch7_393.pdf
1943-11-08batch7_399_page0.txt.txt,1943-11-08,The Balkan Time Bomb,1943,NA,"Nov 8, 1943","Mr. Hull might well suggest to Messrs. Stalin and Molotoff that if the quickest way to crack Germany is in the north and west, Russia ought to explain why she is aiming her heaviest blows near the Balkans. The answer, however, is clear enough. The Balkans and their neighbors, Rumania and Hungary, are the softest spots in Hitler's fortress, and perhaps even before Russia reaches Odessa, as she may within many weeks, what is up will be plain.",batch7_399.pdf
1943-10-11batch8_3_page0.txt.txt,1943-10-11,The Polish Problem,1943,NA,"Oct 11, 1943","Unending books have pondered the Polish problem, but there is time for no more books before the United States, Britain and Russia reach a workable solution. For if a new Poland agreeable to Russians and tolerable to Poles cannot be created, a hard-won war may founder in a lost peace.",batch8_3.pdf
1943-09-20batch8_5_page0.txt.txt,1943-09-20,Reparations in Manpower,1943,NA,"Sep 20, 1943","A small item of news recently published may well provide the opening strains of a discussion which will truly reveal Russia's major demands in the peace-making. Professor Eugene Varga of Moscow, in a lecture in that city, said that since Germany has inflicted damages upon Russia vastly greater than those suffered by any other country, Russia should claim reparations commensurate with her losses and should have priority in such reparations.",batch8_5.pdf
1943-07-19batch8_12_page0.txt.txt,1943-07-19,A Voice From the Bureaucracy,1943,NA,"Jul 19, 1943","While the earth-shaking conflicts at the top of our bureaucracy are well known to the public, few people realize what happens down the line among the little fellows in a great government machine. But what happens there is of critical importance to all of us. I have recently received a letter from a man who entered the colossal Federal machine in an important but minor capacity.",batch8_12.pdf
1943-06-21batch8_16_page0.txt.txt,1943-06-21,Postwar Foreign Lending,1943,NA,"Jun 21, 1943","Though international investments may not cause war, they have, over the years, provided plenty of international irritation. But if the full benefits of capitalistic enterprise are to be attained, they must go on in some form. International investment, tied in too closely to the government of the country from which the loans go forth, can be the handmaiden of imperialism, and the road of imperialism for the United States is not a road, I believe, that most of us want to travel.",batch8_16.pdf
1943-05-24batch8_20_page0.txt.txt,1943-05-24,At Home and Abroad,1943,NA,"May 24, 1943","It is now obvious that when the war is over, the high esteem the public will have for brave officers and men who are winning victories abroad and for the sum total of American industry, workers and managers will not be shared by those in Washington who have labored at the job of mobilizing material, food and finances.",batch8_20.pdf
1943-04-19batch8_25_page0.txt.txt,1943-04-19,Getting Down to Earth,1943,NA,"Apr 19, 1943","Expressions of opinion in this country by official Washington, by influential Republican leaders and by the press since Winston Churchill spoke on March 21 indicate that something extraordinary has happened. Clearly, Churchill's blunt, down-to-earth realism has done more to clarify and unite our thinking than anything else since 1939.",batch8_25.pdf
1943-03-01batch8_32_page0.txt.txt,1943-03-01,The Aircraft Industry Looks Ahead,1943,NA,"Mar 1, 1943","Los ANGELES—A fourth trip to the Coast aircraft industry makes clear significant developments in the point of view of those charged with the direction of that extraordinary business—developments they are eager to have the public understand and support. Late in 1941 and early 1942 the industry's leaders were concentrating on meeting the rapid changes that the war was requiring in design, armament and technical equipment.",batch8_32.pdf
1943-02-15batch8_34_page0.txt.txt,1943-02-15,Democratic Dissension,1943,NA,"Feb 15, 1943","Sooner or later all postwar plans and speculations on the domestic front must reckon with the political currents that will determine which party will control the national administration after 1944. If Mr. Roosevelt is elected for a fourth term, business management, agriculture, labor and the average man, as well, will have to figure on a good many certainties—some pleasant, some unpleasant.",batch8_34.pdf
1943-01-11batch8_39_page0.txt.txt,1943-01-11,What Is the British Empire?,1943,NA,"Jan 11, 1943","Since a preliminary to any peace settlement must be a clearer understanding between two major prospective makers of that peace, it is regrettable that so many voices have arisen in this country to deplore Prime Minister Churchill's statement that he did not become Prime Minister ""to preside over the liquidation of the British Empire.""",batch8_39.pdf
1942-12-07batch8_44_page0.txt.txt,1942-12-07,Wanted—Two Chairmen,1942,NA,"Dec 7, 1942","Both major parties are faced with the job of selecting a new chairman. The Republican National Committee meets on Dec. 7 to choose a successor to Joseph Martin Jr., who has served since 1940. No date has as yet been set for a Democratic Committee meeting, but those who follow politics closely look for its announcement within a month or so, when Edward J. Flynn, the present Democratic chairman, is expected to resign.",batch8_44.pdf
