new_filename,date_new,title.y,year.y,max_qda_imported,pubdate,abstract,index
1956-10-22batch6_48_page0.txt.txt,1956-10-22,The Power to Destroy: REFORM,1956,NA,"Oct 22, 1956","That canny maestro, James A. Finnegan, says that of all the issues with which he hopes to elevate Adlai Stevenson to the White House, ""big business"" is the most valuable. And so the Stevenson-Kefauver theme is that the bigs are the deadly enemies of the smalls, driving some into bankruptcy and devouring others by mergers.",batch6_48.pdf
1956-09-10batch6_54_page0.txt.txt,1956-09-10,A Matter of Loyalty: ROLL-CALL ANALYSIS,1956,NA,"Sep 10, 1956","LOS ANGELES—In his Chicago acceptance speech Adlai Stevenson said: ""The truth is that President Eisenhower, cynically coveted as a candidate but ignored as a leader, is largely indebted to Democrats in Congress for what accomplishments he can claim.""",batch6_54.pdf
1956-08-13batch6_57_page0.txt.txt,1956-08-13,Light on an Old Fraud: INDEPENDENTS SCORNED,1956,NA,"Aug 13, 1956","IN WHAT history may call the great Stassen gaffe, the principal therein proposed to ignore the preferences of a great majority of Republican leaders and to present a ticket to please some people in the Republican Party, ""in labor, minorities, and independents"" and ""the independent people at home, important portions of the population abroad, and the uncommitted nations in the world."" Only somewhat less befuddled are those who have been telling us for some years that Republicans should ignore their own party membership and prepare a ticket and program to convert Democrats and to cozen ""independents."" This strategy—very popular these days with people who, while paying lip service to the President, would attack the Republican Party—assumes that there is a fixed number of Democrats and Republicans, with a decisive minority of so-called independents. The conclusion that they would have us draw is that the only way a candidate on the Republican ticket can win is to look so much and talk so much like a ""liberal"" Democrat that voters will switch sides and elect him. This concept I have called ""the myth of a static electorate."" The fallacy behind it is the idea that political action is concerned with conversion, or perhaps reconversion. On the other hand, true masters of politics design political activity—all the printing and oratory, all the piety and wit—to inspire party members with confidence and to stir the sympathetic but lazy to get out and vote. The late Ed Flynn of the Bronx, up to the end F.D.R.'s most intimate political mentor, told me back in the 1930s that his strategy and Mr. Roosevelt's was to assume the loyalty of Democrats who had voted for the party before 1932 and to aim at people who had not been voting but who were radical in outlook. Flynn and Mr. Roosevelt scoffed at the idea of converting Republicans. They were people to attack, not flatter. Flynn scorned the idea of ""independents."" I studied two British elections at firsthand, in 1950 and 1955, and talked with many professional workers in both parties in England, Scotland, and Wales. The lasting lesson I learned was that those realists paid little attention to opposition voters. They used their resources to get out every sympathizer, and many needed plenty of prodding. The contest was a matter of efficiency, and since there were twice as many professional Conservative agents, the victory went to that party. It was left to the theorists in London and Oxford to believe that speeches were decisive. ""Independents"" over there are contemptuously known as ""floaters."" So far as I know, Billy Graham is not trying to turn Catholics and Jews into Methodists and Baptists, but to get at the unaffiliated. He is much too wise to call the unwashed and unsaved ""independent."" In 1952 Stevenson received about 27 million votes, which is roughly the sum of Truman's (1948) 24 million, Wallace's and Thurmond's (1948) 1 million each, and a million more new voters in old Democratic families. Mr. Eisenhower received Dewey's 22 million plus some millions who had been conservatively inclined but indifferent in 1948, plus a number of new voters. Except in the South, there were few conversions. While the 1952 vote was large, there were and are somewhere around 40 million eligibles who failed to vote. That is the market for votes where either party may find a majority. Those nonvoting eligibles are not ""independent."" They are merely inactive. Republicans may confidently assume that more that half of them are inclined to conservatism. The people who are talking about a static electorate also say that, since Democratic candidates for the House received in 1952 more votes than Republican candidates, the Republican Party is a permanent minority. They fail to add that there were 93 districts in which there were no contests and that 82 of them were Democratic. In all contested districts Republican candidates were 3,282,000 votes ahead. Except in describing a single election, it is absurd to talk about minority or majority parties. The size of a party's vote is whatever zeal and hard work can make it.",batch6_57.pdf
1956-07-16batch6_61_page0.txt.txt,1956-07-16,Who Helps Ike?: VICTORIES?,1956,NA,"Jul 16, 1956","IN THE past two weeks I offered in this space an analysis of Senate and House votes on what I called ""divided issues"" during the 83rd Congress and the first session of the 84th. It shows fairly solid support of Republican leadership on major issues in which Republican leadership was arrayed against Democratic leadership.",batch6_61.pdf
1956-06-18batch6_65_page0.txt.txt,1956-06-18,Big-Business Myths: THE GAME,1956,NA,"Jun 18, 1956","SINCE big business will once more be an issue this year, let us note the ripe—perhaps overripe—reflections on the subject by a major Democratic seer. For Joseph C. O'Mahoney has made a career of two ideas—the evils of bigness and the need for Federal incorporation.",batch6_65.pdf
1956-05-07batch6_71_page0.txt.txt,1956-05-07,Will the Farmers Defeat Ike?,1956,NA,"May 7, 1956","IN RECENT weeks, in two notable NEWSWEEK polls, editors over the country have discounted the effect of farm discontent upon the Eisenhower vote this year. The facts bear out their estimates. In the first place, the so-called ""farm vote"" is neither easily identified nor large.",batch6_71.pdf
1956-04-16batch6_74_page0.txt.txt,1956-04-16,Preference Means Discrimination,1956,NA,"Apr 16, 1956","LAST month, Elmer L. Lindseth, president of the Cleveland Electric Illuminating Co., appeared before the Joint Congressional Committee on Atomic Energy. He represented the Edison Electric Institute of which he is a past president and which includes in its membership 93 per cent of the investor-owned electric utility industry.",batch6_74.pdf
1956-03-12batch6_79_page0.txt.txt,1956-03-12,Black Coal for White—I,1956,NA,"Mar 12, 1956","ALONG with the horror stories about the misdeeds of the ""power octopus""—a hardy perennial since the 1890s—the most familiar argument of the Morses and Trumans is that of a ""power shortage"" in the Pacific Northwest. This specter of a blackout must, according to the refrain, be prevented by pouring Federal money into the Columbia and its tributaries.",batch6_79.pdf
1956-02-20batch6_82_page0.txt.txt,1956-02-20,Expert Testimony,1956,NA,"Feb 20, 1956","ON JAN. 31 Robert LeRoy Cochran retired from the U.S. Bureau of the Budget, where he served more than ten years as an expert on the financial and engineering aspects of Federal water-conservation projects. His distinguished career suggests that there is no man in the United States better qualified to advise in that field of Federal activity.",batch6_82.pdf
1956-01-23batch6_86_page0.txt.txt,1956-01-23,A Son of the Gottscheers,1956,NA,"Jan 23, 1956","ALMOST exactly eleven years ago, in an article in this department of NEWSWEEK. I noted that Frank Lausche, Mayor of Cleveland. had journeyed to Washington to invite King Peter of Yugoslavia to visit his city. The invitation was spoken in three languages—Serbian, Slovenian, and English.",batch6_86.pdf
1955-12-05batch6_92_page0.txt.txt,1955-12-05,How About a Real Moderate?,1955,NA,"Dec 5, 1955","IF THE talk of ""moderation"" in and around the recent Democratic jubilee in Chicago had not been reeking with hypocrisy, there would have been a search for a real moderate. Any such adventure into the realities would have brought to those party leaders the sharp logic of nominating Gov. Frank Lausche of Ohio.",batch6_92.pdf
1955-11-28batch6_93_page0.txt.txt,1955-11-28,The Needs of Our Schools,1955,NA,"Nov 28, 1955","DESPITE the ballyhoo for Federal aid that will surround the forth-coming White House Conference on Education, two serious obstacles stand in its way. The first is the fear in the South that Federal money would be used to enforce desegregation. The other is the rational and factual argument against resorting to Federal aid to meet the needs of our schools.",batch6_93.pdf
1955-10-10batch6_100_page0.txt.txt,1955-10-10,Uncle Sam vs. Small Business—I,1955,NA,"Oct 10, 1955","DURING the final days of the recent session of Congress, the President sharply drew the line for what may well be a great constitutional issue. When all the background is considered, the President is magnificently right. The issue concerns the power of the executive department to rid itself of a large number of business activities, mainly in the Defense Department, despite a requirement of Congress that its appropriation committees retain a veto on all such administrative actions.",batch6_100.pdf
1955-09-19batch6_103_page0.txt.txt,1955-09-19,"Knowland, Nixon, and Knight",1955,NA,"Sep 19, 1955","SANTA BARBARA—After these six weeks up and down the West Coast, I expect that politically minded friends in the East will ask what California thinks about its two sons who occupy the Vice Presidency and the Republican leadership in the Senate. There will also be some inquiries about the man named Knight who succeeded Chief Justice Warren as governor of this state.",batch6_103.pdf
1955-08-08batch6_109_page0.txt.txt,1955-08-08,Socialism Smothered in Oil—I,1955,NA,"Aug 8, 1955","CALGARY, ALBERTA—The dominant political parties in the adjoining provinces of Alberta and Saskatchewan were both born in the agonies of an agricultural depression. They are class parties. Both have been in power a long time—the Cooperative Commonwealth Federation in Saskatchewan since 1944, Social Credit in Alberta since 1935.",batch6_109.pdf
1955-07-18batch6_112_page0.txt.txt,1955-07-18,'See Thou Character',1955,NA,"Jul 18, 1955","You might well pause in your work or play, ladies and gentlemen, and consider for a few moments what it takes to make a great American. It would fit the mood of such a moment of reflection to contemplate, as a vivid example, Herbert Hoover as he completes his latest public service.",batch6_112.pdf
1955-06-13batch6_117_page0.txt.txt,1955-06-13,The Distance and the Direction,1955,NA,"Jun 13, 1955","MANY Americans in discussing the present state of British politics argue that, because there is such agreement on specific policies between Labor and the Conservatives, there is really little to choose between them. Some add to this comment the view that the Conservatives have stolen socialist ideas and can claim only that they will carry them out with more efficiency.",batch6_117.pdf
1955-04-11batch6_124_page0.txt.txt,1955-04-11,The Tampa Gateway,1955,NA,"Apr 11, 1955","TAMPA, FLA. That Florida consists of hot-dog stands, exhibits of alligators and venomous snakes, horse and dog race tracks, motels, bathing beauties, hairy men reclining on beaches, and elderly gents playing shuffleboard is a hardy bit of mythology embedded in the minds of a majority of the American people.",batch6_124.pdf
1955-03-28batch6_126_page0.txt.txt,1955-03-28,What Does Reuther Want?,1955,NA,"Mar 28, 1955","IN THE long fight over a guaranteed annual wage, the preliminaries of which are already under way, tons of economic data will be fired by both sides. But the wisest people with whom I have talked in Detroit believe that the key to the outcome will be the objectives, ideals, and calculations that lie hidden in the mind of Walter Reuther.",batch6_126.pdf
1955-02-21batch6_131_page0.txt.txt,1955-02-21,Plain Talk in Politics,1955,NA,"Feb 21, 1955",ONE of my favorite thinkers and writers is Bugs Baer. He has said a lot of things I wish I had said first. Recently he paid his respects to the complaint made by some Democrats that Vice President Nixon was too rough in his campaign speeches last fall.,batch6_131.pdf
1955-01-03batch6_138_page0.txt.txt,1955-01-03,A Comptroller Without Control,1955,NA,"Jan 3, 1955","THE President says that tax cuts scheduled for April I must be suspended because, once more, the budget cannot be balanced. Chronic extravagance, which seems to be the order of the day, seems to be due to the inability of the President to resist people who advise new forms of spending and to the fact that the heads of his big departments are the prisoners of the holdover bureaucracy.",batch6_138.pdf
1954-12-27batch6_139_page0.txt.txt,1954-12-27,Endowed by Their Creator,1954,NA,"Dec 27, 1954","AMERICANS might well recall, in this critical phase of the struggle with the Communist world, that the basis of their common interest with the other non-Communist nations is a belief in the law of nations based in large part upon natural law, which is utterly denied by the Marxist creed.",batch6_139.pdf
1954-11-08batch6_146_page0.txt.txt,1954-11-08,"Stevenson, Kefauver, Lausche",1954,NA,"Nov 8, 1954","WITH the election of 1954 tucked away in history, there begins a brisk race for the Democratic Presidential nomination. There will be no announcements for a while, because there is a political conviction that it is bad to start an open hunt for votes too soon. The first in the race draws opposition from all sides, and if he starts early enough, the public tires of his merchandise.",batch6_146.pdf
1954-10-25batch6_148_page0.txt.txt,1954-10-25,The Little Pink Partner,1954,NA,"Oct 25, 1954",THE partnership between the Democratic and Liberal Party in New York is a blend of mauve and pink. In the last four Presidential elections in New York State more Republican than Democratic votes were cast.,batch6_148.pdf
1954-09-13batch6_154_page0.txt.txt,1954-09-13,The High Cost of Politics,1954,NA,"Sep 13, 1954","FROM time to time over the past few years I have offered in this magazine various discourses, critical in nature, on some of the vast reclamation and power projects before Congress. During the past five months I have devoted a number of pieces to two glaring examples of uneconomic spending proposals, the Fryingpan transmountain diversion in Colorado and the Upper Colorado storage project.",batch6_154.pdf
1954-08-09batch6_159_page0.txt.txt,1954-08-09,Shadow of Things to Come,1954,NA,"Aug 9, 1954","IN THE course of a reading of the many, many pages of the TVA vs. Middle South-Southern phase of the Senate debate on the atomic-energy bill, a question presented itself to which the answer was immediately obvious. Those men who screamed their opposition hour after hour were not the breed to strain at a $100 million gnat.",batch6_159.pdf
1954-07-05batch6_164_page0.txt.txt,1954-07-05,What Are Government Operations?,1954,NA,"Jul 5, 1954",THE late Robert M. La Follette over a period of more than twenty years was one of the most industrious and sincere members of the Senate. His crowning legislative achievement was his co-sponsorship of the La Follette-Monroney Legislative Reorganization Act of 1946.,batch6_164.pdf
1954-06-14batch6_167_page0.txt.txt,1954-06-14,More Overlapping,1954,NA,"Jun 14, 1954","During the past few weeks I have attempted in this space to draw attention to a number of legislative proposals which, in the midst of the Donnybrook over who's-the-biggest-liar-in-Washington, may well be rushed through under the pressure of special interests of the Federal bureaucracy and of members of Congress with an eye on elections.",batch6_167.pdf
1954-03-29batch6_176_page0.txt.txt,1954-03-29,A New Look at an Old Fraud,1954,NA,"Mar 29, 1954","HERE, Mr. President, is your issue. Taxes mean more to all of us than anything else that fills the headlines, except the danger of foreign war. They are infinitely more important than the relative veracity of a senator or a Secretary of the Army, or a bad dentist, or an evasive general.",batch6_176.pdf
1954-02-01batch6_184_page0.txt.txt,1954-02-01,The Bricker Amendment—III,1954,NA,"Feb 1, 1954","THE most important part of the Bricker proposal is Section 3, which brings within the regulatory power of Congress the making of executive agreements by more or less anonymous bureaucrats throughout the vast ramifications of the Foreign Service.",batch6_184.pdf
1954-01-25batch6_185_page0.txt.txt,1954-01-25,The Bricker Amendment-II,1954,NA,"Jan 25, 1954","THAT it is possible, even inevitable that any President and Secretary of State become the helpless victims of the State Department bureaucracy is the firm contention of j. Anthony Panuch. Experience gives this man an authority that arrests attention. Panuch served the Federal government from 1938 to 1950.",batch6_185.pdf
1953-12-07batch6_192_page0.txt.txt,1953-12-07,Building Up McCarthy,1953,NA,"Dec 7, 1953",A NUMBER of personal convictions should be stated clearly at the beginning of this piece in order that my major point will not sound like a mealy-mouthed effort to play both sides of the street. I cannot agree with those who say that they approve of Senator McCarthy's objectives but strongly disapprove of his methods.,batch6_192.pdf
1953-11-30batch6_193_page0.txt.txt,1953-11-30,'Excessive Abuse',1953,NA,"Nov 30, 1953","ADDRESSING himself to the disgraceful exhibition of bias and bad manners by some of the correspondents at the President's Armistice Day press conference, Richard Wilson of the Cowles publications said: ""There was an excessive abuse of the privilege of the press by newspapermen who ought to know better.""",batch6_193.pdf
1953-10-12batch6_200_page0.txt.txt,1953-10-12,Not Location but Direction,1953,NA,"Oct 12, 1953","IN ANY consideration of the nomination of Earl Warren for Chief Justice of the United States, many facets appear which deserve comment far more lengthy than this space permits. The selection was more obviously political than any other in our history.",batch6_200.pdf
1953-09-28batch6_202_page0.txt.txt,1953-09-28,High Taxes and Hard Work,1953,NA,"Sep 28, 1953","THERE are still old-fashioned folks among us who believe that high taxes discourage hard work, extra effort, more production, and hence more income and more taxes to pay. They agree with the tramp in the cartoon who said: ""I finally found a way to beat the income tax and I haven't worked since.""",batch6_202.pdf
1953-08-24batch6_207_page0.txt.txt,1953-08-24,Rediscovering Congress,1953,NA,"Aug 24, 1953","SANTA BARBARA, CALIF.—The history of these times may well record that in this momentous year there was seen a very significant constitutional change in the United States. That change, a matter of Custom rather than of formal amendment, has been the re-establishment ol Congress as a coequal with the Executive in our Federal government.",batch6_207.pdf
1953-07-13batch6_213_page0.txt.txt,1953-07-13,Propaganda vs. Education,1953,NA,"Jul 13, 1953","BAY CITY, Mich.—Two years ago, stopping in a certain city, I needed a copy of a book by Henry George. I went to a bookstore near the university and expressed my need to a young man working there.",batch6_213.pdf
1953-06-22batch6_216_page0.txt.txt,1953-06-22,"Unfair and Vicious, But",1953,NA,"Jun 22, 1953","SINCE everyone concerned believes the excess-profits tax is bad, we need not dwell upon why it is bad but on the reasons why the Administration and the Republican leadership want it continued.",batch6_216.pdf
1953-05-25batch6_220_page0.txt.txt,1953-05-25,How to Hide a Handout,1953,NA,"May 25, 1953","SAN FRANCISCO—Representatives of all parts of the electrical industry in the West, gathered here for the annual meeting of the Pacific Coast Electrical Association, are primarily interested in what the new Administration proposes to do about Uncle Sam's light-and-power combine.",batch6_220.pdf
1953-04-06batch6_227_page0.txt.txt,1953-04-06,Domesticating Big Mo,1953,NA,"Apr 6, 1953","A little less than a year ago, the Missouri River was front-page news. That sprawling, unpredictable, and unmannerly giant threw its weight about, and the frail creations of mere human beings were scattered or obliterated. Homes, farms, factories, highways, and railroads were overwhelmed.",batch6_227.pdf
1953-03-23batch6_229_page0.txt.txt,1953-03-23,Army Over Ideology,1953,NA,"Mar 23, 1953","THE quotation which follows is an appraisal of the recent reorganization of the Soviet, written at my request by a man who speaks with the authority of intimate knowledge and long study of the Communist world and its ideologies and intrigues. For a sufficient reason, his name is withheld.",batch6_229.pdf
1953-02-23batch6_233_page0.txt.txt,1953-02-23,Proliferation,1953,NA,"Feb 23, 1953","WITH a number of the points made in James B. Conant's twentieth and last report as president of Harvard University it would be easy to disagree. On one point, however, he will elicit hearty applause from anyone who has followed the trend of higher education over the past generation.",batch6_233.pdf
1953-01-26batch6_237_page0.txt.txt,1953-01-26,A Road Away From Statism,1953,NA,"Jan 26, 1953",ON A recent radio program I was asked by the moderator whether I was worried about the number of businessmen whom Eisenhower had chosen for his official family. I answered that I was not nearly so worried as I would be if I were one of the businessmen concerned.,batch6_237.pdf
1952-12-29batch6_241_page0.txt.txt,1952-12-29,On Giving and Getting,1952,NA,"Dec 29, 1952","WE HAVE heard a great deal in the year now drawing to a close about official corruption on both the national and local levels. The recent campaign had much to say about the mess in Washington. But now, long after election day, I note that the leading stories on the front pages of New York and Chicago papers deal with political corruption in those cities.",batch6_241.pdf
1952-11-24batch6_246_page0.txt.txt,1952-11-24,Civil Rights—The Right Way,1952,NA,"Nov 24, 1952","IN THE days immediately following the election I found in Texas a determination by leading citizens to end the long contention over civil rights. One of those citizens, Neville Penrose of Fort Worth, told me of his intention to carry to this week's Southern Governors' Conference a proposal for practical action by the South to resolve this issue once and for all.",batch6_246.pdf
1952-10-27batch6_250_page0.txt.txt,1952-10-27,The Man and the Party: The Vote Is The Pay-off,1952,NA,"Oct 27, 1952","MY FIRST choice of a title for this, my semifinal preelection Piece, was ""To the Independent Voter."" But I have never seen a genuine independent, and if I did so I would not like him. The stigmata of such a person would be a repellent isolation of mind and selfishness of the spirit.",batch6_250.pdf
1952-09-22batch6_255_page0.txt.txt,1952-09-22,Same Theme With Variations,1952,NA,"Sep 22, 1952","GOVERNOR STEVENSON'S speech on foreign policy in San Francisco, like most of his compositions, hardly belongs in the realm of practical statesmanship. It belongs in the thin air of impressionistic artistry. Perhaps we should call it ""Variations on a Theme by Acheson.""",batch6_255.pdf
1952-08-18batch6_259_page0.txt.txt,1952-08-18,Advice for the Amateurs,1952,NA,"Aug 18, 1952","SANTA BARBARA—THE issue of jurisdiction in this campaign between the amateur ""Citizens for Eisenhower"" and the professional Republican National Committee was resolved after days of discussion in Denver. The Citizens for Eisenhower group will maintain its distinctive status, but there must be clearance at all levels— national, state, and local.",batch6_259.pdf
1952-07-21batch6_263_page0.txt.txt,1952-07-21,To Those Who Lost and Those Who Won,1952,NA,"Jul 21, 1952","CHICAGO—Among the many lessons that human beings must learn is bow to behave in defeat. Because that requires restraint in the midst of the pangs of disappointment, it is in truth a most difficult role to play. But it is much more difficult to learn how to behave in victory.",batch6_263.pdf
1952-06-23batch6_267_page0.txt.txt,1952-06-23,Knee-Deep in June,1952,NA,"Jun 23, 1952","So MANY things in politics are happening these days that this offering must be a series of thumbnail views and opinions. ►It is knee-deep in June, and Democrats are hoping that by this time in July the Republican Party will he knee-deep in its own blood.",batch6_267.pdf
1952-05-19batch6_271_page0.txt.txt,1952-05-19,Miracle in Texas,1952,NA,"May 19, 1952",TULSA—This piece is written after fifteen days in Texas observing what Mark Twain would describe as a planned miracle. It was a most exciting demonstration of political revolt.,batch6_271.pdf
1952-04-14batch6_276_page0.txt.txt,1952-04-14,Among the Democrats,1952,NA,"Apr 14, 1952","FOR the first time in nearly twenty years the Democratic Party is without a single controlling hand. It is on its own now. The legal means are within its reach to hold itself together, to find unity among its variegated members and sections, and to choose a new candidate.",batch6_276.pdf
